{
  "$schema": "./items.schema.json",
  "schemaVersion": 1,
  "gameId": "nine-lives-one-heist",
  "defaultLocationId": "location.first-steps",
  "replicaFile": "replicas.json",
  "items": [
    { "id": "object.loot.candy", "kind": "object", "name": "Candy treat", "defaults": { "type": "loot", "variant": "candy", "tags": ["optional"] } },
    { "id": "object.loot.coin", "kind": "object", "name": "Coin treat", "defaults": { "type": "loot", "variant": "coin", "tags": ["optional"] } },
    { "id": "object.loot.gem", "kind": "object", "name": "Gem treat", "defaults": { "type": "loot", "variant": "gem", "tags": ["optional"] } },
    { "id": "object.loot.moon", "kind": "object", "name": "Moon medallion", "defaults": { "type": "loot", "variant": "moon", "tags": ["secret"] } },
    { "id": "object.hazard.spikes", "kind": "object", "name": "Readable spikes", "defaults": { "type": "hazard", "variant": "spikes", "size": { "width": 70, "height": 22 } } },
    { "id": "object.enemy.raccoon", "kind": "object", "name": "Raccoon guard", "defaults": { "type": "enemy", "variant": "raccoon", "role": "sleepy", "speed": 68 } },
    { "id": "object.enemy.bat", "kind": "object", "name": "Bat", "defaults": { "type": "enemy", "variant": "bat", "role": "loop", "speed": 72 } },
    { "id": "object.decor.lamp", "kind": "object", "name": "Checkpoint lamp", "defaults": { "type": "decor", "variant": "lamp" } },
    { "id": "object.decor.pumpkin", "kind": "object", "name": "Pumpkin", "defaults": { "type": "decor", "variant": "pumpkin" } },
    { "id": "object.checkpoint", "kind": "object", "name": "Checkpoint", "defaults": { "type": "checkpoint", "respawnOffset": { "x": 20, "y": 0 } } },
    {
      "id": "location.chapter-one",
      "kind": "location",
      "name": "Chapter One: Moonlit Manor",
      "description": "Recover the town's treats across six short manor missions.",
      "children": [
        "location.first-steps",
        "location.treat-trail",
        "location.guard-trouble",
        "location.pumpkin-secrets",
        "location.rooftop-rescue",
        "location.moon-vault"
      ]
    },
    {
      "id": "location.first-steps",
      "kind": "location",
      "name": "First Steps",
      "order": 1,
      "levelFile": "levels/level-01-first-steps.json",
      "questIds": ["quest.first-steps.complete", "quest.first-steps.secret", "quest.first-steps.challenge"]
    },
    {
      "id": "location.treat-trail",
      "kind": "location",
      "name": "Treat Trail",
      "order": 2,
      "levelFile": "levels/level-02-treat-trail.json",
      "requires": ["reward.first-steps.adventure"],
      "questIds": ["quest.treat-trail.complete", "quest.treat-trail.secret", "quest.treat-trail.challenge"]
    },
    {
      "id": "location.guard-trouble",
      "kind": "location",
      "name": "Guard Trouble",
      "order": 3,
      "levelFile": "levels/level-03-guard-trouble.json",
      "requires": ["reward.treat-trail.adventure"],
      "questIds": ["quest.guard-trouble.complete", "quest.guard-trouble.secret", "quest.guard-trouble.challenge"]
    },
    {
      "id": "location.pumpkin-secrets",
      "kind": "location",
      "name": "Pumpkin Secrets",
      "order": 4,
      "levelFile": "levels/level-04-pumpkin-secrets.json",
      "requires": ["reward.guard-trouble.adventure"],
      "questIds": ["quest.pumpkin-secrets.complete", "quest.pumpkin-secrets.secret", "quest.pumpkin-secrets.challenge"]
    },
    {
      "id": "location.rooftop-rescue",
      "kind": "location",
      "name": "Rooftop Rescue",
      "order": 5,
      "levelFile": "levels/level-05-rooftop-rescue.json",
      "requires": ["reward.pumpkin-secrets.adventure"],
      "questIds": ["quest.rooftop-rescue.complete", "quest.rooftop-rescue.secret", "quest.rooftop-rescue.challenge"]
    },
    {
      "id": "location.moon-vault",
      "kind": "location",
      "name": "The Moon Vault",
      "order": 6,
      "levelFile": "levels/level-06-moon-vault.json",
      "requires": ["reward.rooftop-rescue.adventure"],
      "questIds": ["quest.moon-vault.complete", "quest.moon-vault.secret", "quest.moon-vault.challenge"]
    },

    { "id": "quest.first-steps.complete", "kind": "quest", "badge": "adventure", "title": "Reach the cemetery gate", "rewardIds": ["reward.first-steps.adventure"] },
    { "id": "quest.first-steps.secret", "kind": "quest", "badge": "secret", "title": "Open the tutorial pumpkin cache", "rewardIds": ["reward.first-steps.secret"] },
    { "id": "quest.first-steps.challenge", "kind": "quest", "badge": "challenge", "title": "Collect every treat", "rewardIds": ["reward.first-steps.challenge"] },
    { "id": "quest.treat-trail.complete", "kind": "quest", "badge": "adventure", "title": "Recover five treats and reach the courtyard", "rewardIds": ["reward.treat-trail.adventure"] },
    { "id": "quest.treat-trail.secret", "kind": "quest", "badge": "secret", "title": "Find the treat behind the old pine", "rewardIds": ["reward.treat-trail.secret"] },
    { "id": "quest.treat-trail.challenge", "kind": "quest", "badge": "challenge", "title": "Finish without touching a hazard", "rewardIds": ["reward.treat-trail.challenge"] },
    { "id": "quest.guard-trouble.complete", "kind": "quest", "badge": "adventure", "title": "Pass three guard posts", "rewardIds": ["reward.guard-trouble.adventure"] },
    { "id": "quest.guard-trouble.secret", "kind": "quest", "badge": "secret", "title": "Open the pumpkin by the lookout", "rewardIds": ["reward.guard-trouble.secret"] },
    { "id": "quest.guard-trouble.challenge", "kind": "quest", "badge": "challenge", "title": "Finish without being fully spotted", "rewardIds": ["reward.guard-trouble.challenge"] },
    { "id": "quest.pumpkin-secrets.complete", "kind": "quest", "badge": "adventure", "title": "Find the cache and moon medallion", "rewardIds": ["reward.pumpkin-secrets.adventure"] },
    { "id": "quest.pumpkin-secrets.secret", "kind": "quest", "badge": "secret", "title": "Find all three bonus cache treasures", "rewardIds": ["reward.pumpkin-secrets.secret"] },
    { "id": "quest.pumpkin-secrets.challenge", "kind": "quest", "badge": "challenge", "title": "Bamboozle every raccoon", "rewardIds": ["reward.pumpkin-secrets.challenge"] },
    { "id": "quest.rooftop-rescue.complete", "kind": "quest", "badge": "adventure", "title": "Rescue the ghost and reach the vault wing", "rewardIds": ["reward.rooftop-rescue.adventure"] },
    { "id": "quest.rooftop-rescue.secret", "kind": "quest", "badge": "secret", "title": "Find the high-route moon treasure", "rewardIds": ["reward.rooftop-rescue.secret"] },
    { "id": "quest.rooftop-rescue.challenge", "kind": "quest", "badge": "challenge", "title": "Complete the roofs without a rescue", "rewardIds": ["reward.rooftop-rescue.challenge"] },
    { "id": "quest.moon-vault.complete", "kind": "quest", "badge": "adventure", "title": "Open the vault and escape", "rewardIds": ["reward.moon-vault.adventure"] },
    { "id": "quest.moon-vault.secret", "kind": "quest", "badge": "secret", "title": "Recover the final moon medallion", "rewardIds": ["reward.moon-vault.secret"] },
    { "id": "quest.moon-vault.challenge", "kind": "quest", "badge": "challenge", "title": "Escape with every treasure", "rewardIds": ["reward.moon-vault.challenge"] },

    { "id": "reward.first-steps.adventure", "kind": "reward", "rewardType": "paw", "badge": "adventure", "unlocks": ["location.treat-trail"] },
    { "id": "reward.first-steps.secret", "kind": "reward", "rewardType": "paw", "badge": "secret" },
    { "id": "reward.first-steps.challenge", "kind": "reward", "rewardType": "paw", "badge": "challenge" },
    { "id": "reward.treat-trail.adventure", "kind": "reward", "rewardType": "paw", "badge": "adventure", "unlocks": ["location.guard-trouble"] },
    { "id": "reward.treat-trail.secret", "kind": "reward", "rewardType": "paw", "badge": "secret" },
    { "id": "reward.treat-trail.challenge", "kind": "reward", "rewardType": "paw", "badge": "challenge" },
    { "id": "reward.guard-trouble.adventure", "kind": "reward", "rewardType": "paw", "badge": "adventure", "unlocks": ["location.pumpkin-secrets"] },
    { "id": "reward.guard-trouble.secret", "kind": "reward", "rewardType": "paw", "badge": "secret" },
    { "id": "reward.guard-trouble.challenge", "kind": "reward", "rewardType": "paw", "badge": "challenge" },
    { "id": "reward.pumpkin-secrets.adventure", "kind": "reward", "rewardType": "paw", "badge": "adventure", "unlocks": ["location.rooftop-rescue"] },
    { "id": "reward.pumpkin-secrets.secret", "kind": "reward", "rewardType": "paw", "badge": "secret" },
    { "id": "reward.pumpkin-secrets.challenge", "kind": "reward", "rewardType": "paw", "badge": "challenge" },
    { "id": "reward.rooftop-rescue.adventure", "kind": "reward", "rewardType": "paw", "badge": "adventure", "unlocks": ["location.moon-vault"] },
    { "id": "reward.rooftop-rescue.secret", "kind": "reward", "rewardType": "paw", "badge": "secret" },
    { "id": "reward.rooftop-rescue.challenge", "kind": "reward", "rewardType": "paw", "badge": "challenge" },
    { "id": "reward.moon-vault.adventure", "kind": "reward", "rewardType": "paw", "badge": "adventure", "unlocks": ["location.chapter-one-complete"] },
    { "id": "reward.moon-vault.secret", "kind": "reward", "rewardType": "paw", "badge": "secret" },
    { "id": "reward.moon-vault.challenge", "kind": "reward", "rewardType": "paw", "badge": "challenge" }
  ]
}
